00:18.2 Host bridge: Advanced Micro Devices [AMD] K8 [Athlon64/Opteron] DRAM Controller
    Control: I/O- Mem- BusMaster- SpecCycle- MemWINV- VGASnoop- ParErr- Stepping- SERR- FastB2B- DisINTx-
    Status: Cap- 66MHz- UDF- FastB2B- ParErr- DEVSEL=fast >TAbort- <TAbort- <MAbort- >SERR- <PERR- INTx-
00: 22 10 02 11 00 00 00 00 00 00 00 06 00 00 80 00
10: 00 00 00 00 00 00 00 00 00 00 00 00 00 00 00 00
20: 00 00 00 00 00 00 00 00 00 00 00 00 00 00 00 00
30: 00 00 00 00 00 00 00 00 00 00 00 00 00 00 00 00
40: 00 00 00 00 00 00 00 00 01 00 00 00 01 00 00 01
50: 01 00 00 02 01 00 00 03 01 00 00 04 01 00 00 05
60: 00 00 00 00 e0 3f f8 00 e0 3f f8 00 e0 3f f8 00
70: 00 00 00 00 00 00 00 00 66 00 00 00 00 00 00 00
80: 80 88 00 00 00 00 00 00 24 b2 68 e3 50 5b 02 49
90: 10 e8 08 00 7a 80 00 a4 30 00 00 80 00 00 00 00
a0: e9 02 00 e3 00 00 00 00 00 00 00 00 00 00 00 00
b0: b4 57 88 f5 5a 00 00 00 7f 0c 6b 67 0c 48 00 01
c0: 00 00 00 00 00 00 00 00 00 00 00 00 00 00 00 00
d0: 9f 76 62 72 89 83 11 20 21 ad 9d 60 c6 a4 19 00
e0: 8b 12 31 29 c9 42 89 24 40 4a 14 21 c6 24 01 23
f0: 00 00 00 00 00 00 00 00 00 00 00 00 00 00 00 00

